{"format":"mantra.template-acceptance-report/2","engine":{"mantra":"1.0.0-rc.1","normein":"0.3.0"},"suiteSha256":"4bc16525d66a9eabd2671fc424a1dcee830025e0323a8c50e467f9410b19942b","passed":false,"cases":[{"id":"styled-main-and-matrix","case":"case.mantra","status":"conflict","baseRevision":"aecaf4a533d59232ad38f33280358e9ca8b3a53b6e4efdbea791be87cf8865d7","baseRevisions":{"case.mantra":"cb76be584f0ca4654af4a9b19e1d37e05ba55cff81f1f158045a185a8becbe80","layout.mantra":"080ea9e19770fa535373884f7a39995ef7fc5dd34c3fd8ce1f8aecfd3711ddb8","schema.mantra":"217248d7c2aa77bf06213a9dd5e593c9a0dd83da874cb1fd3d5260ffd362d9a1"},"proposedRevision":null,"succeeded":null,"validationPassed":null,"diagnostics":[],"difference":null,"assertions":[],"error":{"problem":"CONFLICT","message":"Pinned acceptance baseline differs for case.mantra","currentRevision":"da3a0ffcd9b645b59265609cd8d8c5926021df8bfe2d0743a07816d1c267d455"},"paper":null},{"id":"show-zero","case":"case.mantra","status":"conflict","baseRevision":"aecaf4a533d59232ad38f33280358e9ca8b3a53b6e4efdbea791be87cf8865d7","baseRevisions":{"case.mantra":"cb76be584f0ca4654af4a9b19e1d37e05ba55cff81f1f158045a185a8becbe80","layout.mantra":"080ea9e19770fa535373884f7a39995ef7fc5dd34c3fd8ce1f8aecfd3711ddb8","schema.mantra":"217248d7c2aa77bf06213a9dd5e593c9a0dd83da874cb1fd3d5260ffd362d9a1"},"proposedRevision":null,"succeeded":null,"validationPassed":null,"diagnostics":[],"difference":null,"assertions":[],"error":{"problem":"CONFLICT","message":"Pinned acceptance baseline differs for case.mantra","currentRevision":"da3a0ffcd9b645b59265609cd8d8c5926021df8bfe2d0743a07816d1c267d455"},"paper":null},{"id":"matrix-panel","case":"case.mantra","status":"conflict","baseRevision":"aecaf4a533d59232ad38f33280358e9ca8b3a53b6e4efdbea791be87cf8865d7","baseRevisions":{"case.mantra":"cb76be584f0ca4654af4a9b19e1d37e05ba55cff81f1f158045a185a8becbe80","layout.mantra":"080ea9e19770fa535373884f7a39995ef7fc5dd34c3fd8ce1f8aecfd3711ddb8","schema.mantra":"217248d7c2aa77bf06213a9dd5e593c9a0dd83da874cb1fd3d5260ffd362d9a1"},"proposedRevision":null,"succeeded":null,"validationPassed":null,"diagnostics":[],"difference":null,"assertions":[],"error":{"problem":"CONFLICT","message":"Pinned acceptance baseline differs for case.mantra","currentRevision":"da3a0ffcd9b645b59265609cd8d8c5926021df8bfe2d0743a07816d1c267d455"},"paper":null},{"id":"german-raw-input","case":"case.mantra","status":"conflict","baseRevision":"aecaf4a533d59232ad38f33280358e9ca8b3a53b6e4efdbea791be87cf8865d7","baseRevisions":{"case.mantra":"cb76be584f0ca4654af4a9b19e1d37e05ba55cff81f1f158045a185a8becbe80","layout.mantra":"080ea9e19770fa535373884f7a39995ef7fc5dd34c3fd8ce1f8aecfd3711ddb8","schema.mantra":"217248d7c2aa77bf06213a9dd5e593c9a0dd83da874cb1fd3d5260ffd362d9a1"},"proposedRevision":null,"succeeded":null,"validationPassed":null,"diagnostics":[],"difference":null,"assertions":[],"error":{"problem":"CONFLICT","message":"Pinned acceptance baseline differs for case.mantra","currentRevision":"da3a0ffcd9b645b59265609cd8d8c5926021df8bfe2d0743a07816d1c267d455"},"paper":null}]}
